日期,指数名称,成分券代码,成分券名称
2020-03-06,沪公司债,雅砻江流域水电开发有限公司2019年面向合格投资者公开发行公司债券(第一期),ETCB 20190425 5Y 3.93%
2020-03-06,沪公司债,北京市朝阳区国有资本经营管理中心2019年公开发行纾困专项公司债券(第一期),ETCB 20190426 5Y 4.19%
2020-03-06,沪公司债,江西省投资集团有限公司2019年公开发行公司债券(第一期)品种一,ETCB 20190429 3Y 4.2%
2020-03-06,沪公司债,金光纸业(中国)投资有限公司2019年公开发行公司债券(第一期),ETCB 20190425 3Y 7%
2020-03-06,沪公司债,中国邮政集团公司2019年公司债券(第一期),ETCB 20190425 5Y 3.9%
2020-03-06,沪公司债,上海紫竹高新区(集团)有限公司公开发行2019年公司债券(第一期),ETCB 20190513 5Y 5.45%
2020-03-06,沪公司债,北京电子控股有限责任公司2019年面向合格投资者公开发行公司债券,ETCB 20190612 3Y 3.81%
2020-03-06,沪公司债,晋中市公用基础设施投资控股(集团)有限公司公开发行2019年公司债券(第一期),ETCB 20190429 5Y 5.3%
2020-03-06,沪公司债,深圳航空有限责任公司2019年公开发行公司债券(第一期),ETCB 20190426 3Y 4%
2020-03-06,沪公司债,中国南方电网有限责任公司公开发行2019年公司债券(第一期),ETCB 20190425 3Y 3.95%
2020-03-06,沪公司债,新疆绿原国有资产经营集团有限公司2019年公开发行公司债券(第一期),ETCB 20190507 3Y 6.6%
2020-03-06,沪公司债,上海世茂股份有限公司公开发行2019年公司债券(第三期),ETCB 20190522 3Y 4.15%
2020-03-06,沪公司债,新兴际华集团有限公司2019年公开发行公司债券(第一期)品种一,ETCB 20190523 3Y 3.85%
2020-03-06,沪公司债,湖北省宏泰国有资本投资运营集团有限公司公开发行2019年公司债券,ETCB 20190506 5Y 5%
2020-03-06,沪公司债,上海陆家嘴金融贸易区开发股份有限公司公开发行2019年公司债券(第二期),ETCB 20190513 5Y 3.88%
2020-03-06,沪公司债,国药控股(中国)融资租赁有限公司2019年面向合格投资者公开发行公司债券(第一期),ETCB 20190429 3Y 4.58%
2020-03-06,沪公司债,山东高速集团有限公司公开发行2019年公司债券(第一期),ETCB 20190508 15Y 4.89%
2020-03-06,沪公司债,杭州市实业投资集团有限公司2019年公开发行公司债券(第一期)(品种一),ETCB 20190509 5Y 4.09%
2020-03-06,沪公司债,齐鲁交通发展集团有限公司公开发行2019年公司债券(面向合格投资者)(第一期),ETCB 20190604 5Y 3.9%
2020-03-06,沪公司债,淮北矿业股份有限公司2019年面向合格投资者公开发行公司债券(第一期),ETCB 20190429 3Y 4.8%
2020-03-06,沪公司债,广州富力地产股份有限公司公开发行2019年公司债券(第一期)品种一,ETCB 20190509 4Y 5.6%
2020-03-06,沪公司债,广州富力地产股份有限公司公开发行2019年公司债券(第一期)品种二,ETCB 20190509 5Y 6.48%
2020-03-06,沪公司债,恒大地产集团有限公司2019年公开发行公司债券(第一期)(品种一),ETCB 20190506 4Y 6.27%
2020-03-06,沪公司债,恒大地产集团有限公司2019年公开发行公司债券(第一期)(品种二),ETCB 20190506 5Y 6.8%
2020-03-06,沪公司债,无锡市新发集团有限公司2019年公开发行公司债券(面向合格投资者)(第三期)(品种一),ETCB 20190506 5Y 4.6%
2020-03-06,沪公司债,中国光大实业(集团)有限责任公司2019年面向合格投资者公开发行公司债券(第一期),ETCB 20190514 3Y 5%
2020-03-06,沪公司债,广州市城市建设开发有限公司2019年公开发行住房租赁专项公司债券(第一期)品种一,ETCB 20190520 5Y 3.83%
2020-03-06,沪公司债,郑州宇通集团有限公司2019年公开发行公司债券(第一期),ETCB 20190514 5Y 3.93%
2020-03-06,沪公司债,广州港股份有限公司公开发行2019年公司债券(第一期),ETCB 20190516 3Y 3.78%
2020-03-06,沪公司债,中银国际证券股份有限公司2019年公开发行公司债券(第一期),ETCB 20190517 3Y 3.73%
2020-03-06,沪公司债,上海隧道工程股份有限公司2019年公开发行公司债券(第一期),ETCB 20190517 3Y 3.8%
2020-03-06,沪公司债,中国南方航空股份有限公司2019年公开发行公司债券(第二期),ETCB 20190517 3Y 3.72%
2020-03-06,沪公司债,中信泰富有限公司2019年公开发行公司债券(第一期),ETCB 20190520 3Y 3.9%
2020-03-06,沪公司债,中国南方电网有限责任公司公开发行2019年公司债券(第二期)(品种一),ETCB 20190517 3Y 3.72%
2020-03-06,沪公司债,中国南方电网有限责任公司公开发行2019年公司债券(第二期)(品种二),ETCB 20190517 5Y 4.05%
2020-03-06,沪公司债,天津城市基础设施建设投资集团有限公司2019年公开发行公司债券(第六期)(品种一),ETCB 20190521 6Y 4.1%
2020-03-06,沪公司债,天津城市基础设施建设投资集团有限公司2019年公开发行公司债券(第六期)(品种二),ETCB 20190521 10Y 4.64%
2020-03-06,沪公司债,国泰君安证券股份有限公司公开发行2019年公司债券(第二期),ETCB 20190517 3Y 3.73%
2020-03-06,沪公司债,中广核风电有限公司2019年公开发行公司债券(第二期)品种一,ETCB 20190520 5Y 4.35%
2020-03-06,沪公司债,中广核风电有限公司2019年公开发行公司债券(第二期)品种二,ETCB 20190520 10Y 4.71%
2020-03-06,沪公司债,国家开发投资集团有限公司2019年面向合格投资者公开发行公司债券(第一期),ETCB 20190520 3Y 3.72%
2020-03-06,沪公司债,四川路桥建设集团股份有限公司2019年面向合格投资者公开发行公司债券(第一期),ETCB 20190520 3Y 4.34%
2020-03-06,沪公司债,金辉集团股份有限公司面向合格投资者公开发行2019年公司债券(第一期),ETCB 20190523 4Y 7.5%
2020-03-06,沪公司债,平安证券股份有限公司面向合格投资者公开发行2019年公司债券(第三期),ETCB 20190527 5Y 3.73%
2020-03-06,沪公司债,华润医药控股有限公司公开发行2019年公司债券(第一期),ETCB 20190524 3Y 3.78%
2020-03-06,沪公司债,北京市基础设施投资有限公司2019年面向合格投资者公开发行公司债券(第二期)(品种一),ETCB 20190527 3Y 3.75%
2020-03-06,沪公司债,北京市基础设施投资有限公司2019年面向合格投资者公开发行公司债券(第二期)(品种二),ETCB 20190527 5Y 4.15%
2020-03-06,沪公司债,中泰证券股份有限公司公开发行2019年公司债券(第一期),ETCB 20190808 3Y 3.57%
2020-03-06,沪公司债,苏州城市建设投资发展有限责任公司公开发行2019年公司债券(面向合格投资者)(第二期),ETCB 20190527 5Y 3.8%
2020-03-06,沪公司债,中国南方电网有限责任公司公开发行2019年公司债券(第三期),ETCB 20190530 5Y 4.1%
2020-03-06,沪公司债,广州市城市建设开发有限公司2019年面向合格投资者公开发行公司债券(第一期)品种一,ETCB 20190528 3Y 3.85%
2020-03-06,沪公司债,广州市城市建设开发有限公司2019年面向合格投资者公开发行公司债券(第一期)品种二,ETCB 20190528 5Y 3.93%
2020-03-06,沪公司债,中远海运租赁有限公司2019年公开发行公司债券(第一期),ETCB 20190711 3Y 5%
2020-03-06,沪公司债,中国船舶工业集团有限公司2019年公开发行公司债券(第一期)品种一,ETCB 20190529 4Y 3.7%
2020-03-06,沪公司债,中国核工业集团有限公司2019年公开发行公司债券(第一期)品种一,ETCB 20190531 3Y 3.75%
2020-03-06,沪公司债,中飞租融资租赁有限公司2019年公开发行公司债券(第一期),ETCB 20190610 3Y 5.2%
2020-03-06,沪公司债,天津城市基础设施建设投资集团有限公司2019年公开发行公司债券(第七期)(品种一),ETCB 20190603 4Y 4.18%
2020-03-06,沪公司债,平安国际融资租赁有限公司公开发行2019年公司债券(第二期),ETCB 20190619 5Y 4.03%
2020-03-06,沪公司债,义乌市国有资本运营有限公司2019年公开发行纾困专项公司债券(第一期),ETCB 20190605 5Y 5%
2020-03-06,沪公司债,融侨集团股份有限公司公开发行2019年公司债券(第一期),ETCB 20190603 5Y 6.5%
2020-03-06,沪公司债,中航资本控股股份有限公司2019年公开发行公司债券(第二期),ETCB 20190610 3Y 3.84%
2020-03-06,沪公司债,浙江中国小商品城集团股份有限公司公开发行2019年公司债券(第一期),ETCB 20190605 3Y 4.3%
2020-03-06,沪公司债,天津泰达投资控股有限公司2019年公开发行公司债券(面向合格投资者)(第二期),ETCB 20190610 5Y 5.15%
2020-03-06,沪公司债,北京京能电力股份有限公司公开发行2019年公司债券(第一期),ETCB 20190610 3Y 3.79%
2020-03-06,沪公司债,广州市时代控股集团有限公司2019年面向合格投资者公开发行公司债券(第一期)品种二,ETCB 20190610 5Y 6.8%
2020-03-06,沪公司债,南山集团有限公司2019年公开发行公司债券(第二期),ETCB 20190618 3Y 5.5%
2020-03-06,沪公司债,国投电力控股股份有限公司2019年面向合格投资者公开发行公司债券(第一期),ETCB 20190612 10Y 4.59%
2020-03-06,沪公司债,红星美凯龙家居集团股份有限公司2019年公开发行公司债券(第一期)(品种二),ETCB 20190610 4Y 5.35%
2020-03-06,沪公司债,中航资本控股股份有限公司2019年公开发行公司债券(第三期)(品种一),ETCB 20190719 3Y 3.72%
2020-03-06,沪公司债,天津城市基础设施建设投资集团有限公司2019年公开发行公司债券(第八期)(品种一),ETCB 20190618 4Y 4.34%
2020-03-06,沪公司债,天津城市基础设施建设投资集团有限公司2019年公开发行公司债券(第八期)(品种二),ETCB 20190618 5Y 4.75%
2020-03-06,沪公司债,中国船舶工业集团有限公司2019年公开发行公司债券(第二期),ETCB 20190711 4Y 3.2%
2020-03-06,沪公司债,中国环球租赁有限公司2019年公开发行公司债券(第一期),ETCB 20190619 5Y 4.25%
2020-03-06,沪公司债,合肥兴泰金融控股(集团)有限公司公开发行2019年公司债券(第一期),ETCB 20190614 3Y 4.1%
2020-03-06,沪公司债,昆明交通产业股份有限公司2019年公开发行公司债券(第一期)品种一,ETCB 20190614 5Y 5.4%
2020-03-06,沪公司债,中化能源股份有限公司2019年公开发行公司债券(第一期)(品种一),ETCB 20190620 3Y 3.72%
2020-03-06,沪公司债,山东三星集团有限公司2019年面向合格投资者公开发行公司债券(第一期),ETCB 20190830 5Y 7.9%
2020-03-06,沪公司债,中国华电集团有限公司公开发行2019年公司债券(第二期)(品种一),ETCB 20190620 3Y 3.7%
2020-03-06,沪公司债,中国华电集团有限公司公开发行2019年公司债券(第二期)(品种二),ETCB 20190620 5Y 4.05%
2020-03-06,沪公司债,上海国有资产经营有限公司2019年公开发行公司债券(第一期)(品种二),ETCB 20190619 5Y 4.1%
2020-03-06,沪公司债,福建阳光集团有限公司2019年公开发行公司债券(第三期),ETCB 20190619 3Y 7.5%
2020-03-06,沪公司债,联想控股股份有限公司公开发行2019年公司债券(第二期),ETCB 20190621 5Y 5.5%
2020-03-06,沪公司债,中国联合网络通信有限公司公开发行2019年公司债券(第一期),ETCB 20190619 3Y 3.67%
2020-03-06,沪公司债,华能天成融资租赁有限公司公开发行2019年绿色公司债券(第一期),ETCB 20190620 3Y 4.15%
2020-03-06,沪公司债,中国光大集团股份公司2019年面向合格投资者公开发行公司债券(第一期)(品种一),ETCB 20190624 3Y 3.7%
2020-03-06,沪公司债,中国光大集团股份公司2019年面向合格投资者公开发行公司债券(第一期)(品种二),ETCB 20190624 5Y 4.02%
2020-03-06,沪公司债,山东高速集团有限公司公开发行2019年可续期公司债券(第一期),ETCB 20190621 3Y 4.27%
2020-03-06,沪公司债,四川蓝光发展股份有限公司公开发行2019年公司债券(第二期)(品种一),ETCB 20190723 3Y 7.5%
2020-03-06,沪公司债,重庆公路物流基地建设有限公司公开发行2019年公司债券(第二期),ETCB 20190626 5Y 6.4%
2020-03-06,沪公司债,北京控股集团有限公司公开发行2019年公司债券(第一期),ETCB 20190624 3Y 3.67%
2020-03-06,沪公司债,海宁市资产经营公司2019年公开发行公司债券(第一期)(品种一),ETCB 20190625 5Y 4.59%
2020-03-06,沪公司债,芯鑫融资租赁有限责任公司2019年公开发行公司债券(面向合格投资者)(第一期),ETCB 20190722 2Y 3.99%
2020-03-06,沪公司债,国网节能服务有限公司2019年公开发行公司债券(第二期),ETCB 20190627 3Y 4.07%
2020-03-06,沪公司债,中原资产管理有限公司公开发行2019年公司债券(面向合格投资者)(第二期),ETCB 20190627 5Y 4.4%
2020-03-06,沪公司债,江苏永钢集团有限公司面向合格投资者公开发行2019年公司债券(第一期),ETCB 20190731 5Y 6.5%
2020-03-06,沪公司债,花样年集团(中国)有限公司2019年公开发行公司债券(第一期),ETCB 20190705 3Y 8.2%
2020-03-06,沪公司债,内蒙古伊泰煤炭股份有限公司公开发行2019年公司债券(第二期),ETCB 20190702 5Y 4.75%
2020-03-06,沪公司债,东方集团股份有限公司2019年公开发行公司债券(第二期),ETCB 20190705 3Y 7.5%
2020-03-06,沪公司债,美的置业集团有限公司2019年面向合格投资者公开发行公司债券(第三期),ETCB 20190704 4Y 5.2%
2020-03-06,沪公司债,兰州兰石集团有限公司公开发行2019年公司债券(第二期),ETCB 20190705 5Y 7.5%
2020-03-06,沪公司债,融信(福建)投资集团有限公司公开发行2019年公司债券(第一期)(品种一),ETCB 20190703 4Y 6.45%
2020-03-06,沪公司债,融信(福建)投资集团有限公司公开发行2019年公司债券(第一期)(品种二),ETCB 20190703 5Y 6.78%
2020-03-06,沪公司债,鸿商产业控股集团有限公司面向合格投资者公开发行2019年公司债券(第一期),ETCB 20190709 3Y 6.35%
2020-03-06,沪公司债,北京汽车集团有限公司2019年公开发行公司债券(第二期)(品种一),ETCB 20190704 3Y 3.56%
2020-03-06,沪公司债,北京汽车集团有限公司2019年公开发行公司债券(第二期)(品种二),ETCB 20190704 5Y 3.99%
2020-03-06,沪公司债,北京市文化投资发展集团有限责任公司面向合格投资者公开发行2019年公司债券(第一期),ETCB 20190722 3Y 4.5%
2020-03-06,沪公司债,天津城市基础设施建设投资集团有限公司2019年公开发行公司债券(第九期)(品种一),ETCB 20190710 4Y 4.1%
2020-03-06,沪公司债,天津城市基础设施建设投资集团有限公司2019年公开发行公司债券(第九期)(品种二),ETCB 20190710 5Y 4.55%
2020-03-06,沪公司债,广东恒健投资控股有限公司公开发行2019年公司债券(第一期),ETCB 20190807 5Y 3.84%
2020-03-06,沪公司债,华润电力投资有限公司公开发行2019年公司债券(第二期),ETCB 20190816 3Y 3.4%
2020-03-06,沪公司债,中国中铁股份有限公司公开发行2019年公司债券(第三期)(品种一),ETCB 20190716 3Y 3.59%
2020-03-06,沪公司债,中国中铁股份有限公司公开发行2019年公司债券(第三期)(品种二),ETCB 20190716 5Y 3.99%
2020-03-06,沪公司债,华能国际电力股份有限公司2019年公开发行公司债券(第二期),ETCB 20190709 3Y 3.55%
2020-03-06,沪公司债,山西建设发展有限公司2019年面向合格投资者公开发行公司债券,ETCB 20190807 5Y 5.98%
2020-03-06,沪公司债,北新建材集团有限公司2019年面向合格投资者公开发行公司债券(第一期)(品种一),ETCB 20190718 5Y 3.77%
2020-03-06,沪公司债,建发房地产集团有限公司公开发行2019年公司债券(第一期)(品种一),ETCB 20190709 7Y 4.2%
2020-03-06,沪公司债,建发房地产集团有限公司公开发行2019年公司债券(第一期)(品种二),ETCB 20190709 6Y 3.8%
2020-03-06,沪公司债,重庆龙湖企业拓展有限公司公开发行2019年住房租赁专项公司债券(第一期)(品种一),ETCB 20190719 5Y 3.9%
2020-03-06,沪公司债,重庆龙湖企业拓展有限公司公开发行2019年住房租赁专项公司债券(第一期)(品种二),ETCB 20190719 7Y 4.67%
2020-03-06,沪公司债,国电电力发展股份有限公司2019年公开发行公司债券(面向合格投资者)(第一期),ETCB 20190715 3Y 3.54%
2020-03-06,沪公司债,福州建工(集团)总公司2019年面向合格投资者公开发行公司债券(第一期),ETCB 20190903 5Y 5.48%
2020-03-06,沪公司债,中信证券股份有限公司面向合格投资者公开发行2019年公司债券(第一期)(品种一),ETCB 20190910 3Y 3.39%
2020-03-06,沪公司债,中信证券股份有限公司面向合格投资者公开发行2019年公司债券(第一期)(品种二),ETCB 20190910 5Y 3.78%
2020-03-06,沪公司债,青岛城投金融控股集团有限公司2019年公开发行公司债券(第一期),ETCB 20190723 5Y 3.82%
2020-03-06,沪公司债,北京华融基础设施投资有限责任公司2019年公开发行公司债券(第一期)(品种一),ETCB 20190718 5Y 3.78%
2020-03-06,沪公司债,北京华融基础设施投资有限责任公司2019年公开发行公司债券(第一期)(品种二),ETCB 20190718 5Y 4.17%
2020-03-06,沪公司债,中国中信有限公司2019年公开发行公司债券(第四期)(品种一),ETCB 20190717 10Y 4.46%
2020-03-06,沪公司债,中国中信有限公司2019年公开发行公司债券(第四期)(品种二),ETCB 20190717 15Y 4.6%
2020-03-06,沪公司债,无锡市国联发展(集团)有限公司2019年公开发行公司债券(第二期),ETCB 20190719 3Y 3.75%
2020-03-06,沪公司债,常高新集团有限公司2019年公开发行公司债券(第二期)品种一,ETCB 20190716 5Y 4.59%
2020-03-06,沪公司债,中国建银投资有限责任公司2019年公开发行公司债券(第二期)品种一,ETCB 20190725 3Y 3.68%
2020-03-06,沪公司债,中国建银投资有限责任公司2019年公开发行公司债券(第二期)品种二,ETCB 20190725 5Y 3.98%
2020-03-06,沪公司债,中国邮政集团公司2019年公司债券(第二期),ETCB 20190716 3Y 3.55%
2020-03-06,沪公司债,南京新工投资集团有限责任公司2019年公开发行公司债券(第二期),ETCB 20190717 5Y 3.83%
2020-03-06,沪公司债,西南证券股份有限公司2019年公开发行公司债券(第二期),ETCB 20190718 3Y 3.77%
2020-03-06,沪公司债,天津保税区投资控股集团有限公司2019年公开发行公司债券(面向合格投资者)(第一期),ETCB 20190719 3Y 4.9%
2020-03-06,沪公司债,中国环球租赁有限公司2019年公开发行公司债券(第二期),ETCB 20190821 5Y 3.98%
2020-03-06,沪公司债,京投发展股份有限公司2019年公开发行公司债券(第二期),ETCB 20190717 5Y 3.78%
2020-03-06,沪公司债,中国华电集团有限公司公开发行2019年公司债券(第三期)(品种一),ETCB 20190717 3Y 3.55%
2020-03-06,沪公司债,昆明交通产业股份有限公司2019年公开发行公司债券(第二期)品种一,ETCB 20190806 5Y 5.18%
2020-03-06,沪公司债,上海电气(集团)总公司2019年公开发行公司债券(第一期),ETCB 20190729 5Y 3.55%
2020-03-06,沪公司债,山东省财金投资集团有限公司2019年公开发行公司债券(第一期)(面向合格投资者),ETCB 20190723 5Y 3.95%
2020-03-06,沪公司债,安徽省投资集团控股有限公司2019年公开发行公司债券(第一期)(面向合格投资者),ETCB 20190723 5Y 3.7%
2020-03-06,沪公司债,鲁能集团有限公司2019年公开发行公司债券(第一期)(品种一),ETCB 20190718 5Y 3.85%
2020-03-06,沪公司债,深圳市金证科技股份有限公司2019年公开发行公司债券(面向合格投资者),ETCB 20190726 5Y 4.85%
2020-03-06,沪公司债,天津城市基础设施建设投资集团有限公司2019年公开发行公司债券(第十期)(品种一),ETCB 20190724 4Y 4.11%
2020-03-06,沪公司债,天津城市基础设施建设投资集团有限公司2019年公开发行公司债券(第十期)(品种二),ETCB 20190724 5Y 4.63%
2020-03-06,沪公司债,当代节能置业股份有限公司2019年面向合格投资者公开发行公司债券(第一期),ETCB 20190730 3Y 7.8%
2020-03-06,沪公司债,内蒙古伊泰煤炭股份有限公司公开发行2019年公司债券(第三期),ETCB 20190723 5Y 4.7%
2020-03-06,沪公司债,渤海证券股份有限公司公开发行2019年公司债券(第二期),ETCB 20190801 3Y 3.83%
2020-03-06,沪公司债,湖北省宏泰国有资本投资运营集团有限公司公开发行2019年公司债券(第二期),ETCB 20190729 5Y 4.4%
2020-03-06,沪公司债,国家开发投资集团有限公司2019年面向合格投资者公开发行公司债券(第二期),ETCB 20190725 10Y 4.48%
2020-03-06,沪公司债,北京汽车集团有限公司2019年公开发行公司债券(第三期)(品种一),ETCB 20190801 3Y 3.5%
2020-03-06,沪公司债,北京汽车集团有限公司2019年公开发行公司债券(第三期)(品种二),ETCB 20190801 5Y 3.94%
2020-03-06,沪公司债,中国交通建设股份有限公司2019年面向合格投资者公开发行公司债券(第一期)(品种一),ETCB 20190726 5Y 3.5%
2020-03-06,沪公司债,中国交通建设股份有限公司2019年面向合格投资者公开发行公司债券(第一期)(品种二),ETCB 20190726 7Y 3.97%
2020-03-06,沪公司债,湖南湘投控股集团有限公司公开发行2019年公司债券(第一期),ETCB 20190808 5Y 4.12%
2020-03-06,沪公司债,碧桂园地产集团有限公司2019年公开发行公司债券(第二期),ETCB 20190801 4Y 5.14%
2020-03-06,沪公司债,南京安居建设集团有限责任公司2019年公开发行公司债券(第一期),ETCB 20190725 5Y 3.78%
2020-03-06,沪公司债,中国核工业集团有限公司2019年公开发行公司债券(第二期),ETCB 20190726 5Y 3.55%
2020-03-06,沪公司债,平安不动产有限公司2019年公开发行公司债券(第一期)品种二,ETCB 20190726 7Y 4.4%
2020-03-06,沪公司债,江河创建集团股份有限公司2019年面向合格投资者公开发行公司债券(第一期),ETCB 20190730 2Y 6.8%
2020-03-06,沪公司债,中国兵器装备集团有限公司2019年公开发行公司债券(第三期),ETCB 20191202 3Y 3.5%
2020-03-06,沪公司债,无锡市市政公用产业集团有限公司公开发行2019年公司债券(第一期),ETCB 20190805 5Y 4%
2020-03-06,沪公司债,中国科学院控股有限公司2019年公开发行公司债券(第二期)(面向合格投资者)(品种一),ETCB 20190808 5Y 3.54%
2020-03-06,沪公司债,中国科学院控股有限公司2019年公开发行公司债券(第二期)(面向合格投资者)(品种二),ETCB 20190808 8Y 3.9%
2020-03-06,沪公司债,南方工业资产管理有限责任公司2019年公开发行公司债券(第一期)(品种一),ETCB 20190802 3Y 3.9%
2020-03-06,沪公司债,南山集团有限公司2019年公开发行公司债券(第三期),ETCB 20190807 3Y 5.1%
2020-03-06,沪公司债,苏州国发创业投资控股有限公司公开发行2019年创新创业公司债券(面向合格投资者)(第一期),ETCB 20190808 5Y 3.83%
2020-03-06,沪公司债,中国建材股份有限公司2019年公开发行公司债券(第五期),ETCB 20190805 10Y 4.55%
2020-03-06,沪公司债,建发房地产集团有限公司公开发行2019年公司债券(第二期)(品种一),ETCB 20190808 7Y 4.09%
2020-03-06,沪公司债,建发房地产集团有限公司公开发行2019年公司债券(第二期)(品种二),ETCB 20190808 6Y 3.71%
2020-03-06,沪公司债,北京华融基础设施投资有限责任公司2019年公开发行公司债券(第二期)(品种一),ETCB 20190812 5Y 3.57%
2020-03-06,沪公司债,北京华融基础设施投资有限责任公司2019年公开发行公司债券(第二期)(品种二),ETCB 20190812 5Y 3.98%
2020-03-06,沪公司债,无锡市新发集团有限公司2019年公开发行公司债券(面向合格投资者)(第四期)品种一,ETCB 20190806 5Y 4.08%
2020-03-06,沪公司债,四川蓝光发展股份有限公司公开发行2019年公司债券(第三期),ETCB 20190806 3Y 7%
2020-03-06,沪公司债,中国铝业股份有限公司2019年公开发行公司债券(第二期)品种二,ETCB 20190809 10Y 4.55%
2020-03-06,沪公司债,美的置业集团有限公司2019年面向合格投资者公开发行公司债券(第四期),ETCB 20190805 5Y 5.7%
2020-03-06,沪公司债,东吴证券股份有限公司2019年公开发行公司债券,ETCB 20190812 3Y 3.6%
2020-03-06,沪公司债,民生证券股份有限公司2019年面向合格投资者公开发行公司债券(第一期),ETCB 20191119 3Y 5%
2020-03-06,沪公司债,景德镇市国资运营投资控股集团有限责任公司2019年公开发行公司债券(第一期),ETCB 20190814 5Y 5.65%
2020-03-06,沪公司债,中国南方航空集团有限公司公开发行2019年公司债券(第一期)(面向合格投资者),ETCB 20190813 3Y 3.45%
2020-03-06,沪公司债,联发集团有限公司2019年面向合格投资者公开发行公司债券(第一期)(品种一),ETCB 20190813 5Y 3.74%
2020-03-06,沪公司债,联发集团有限公司2019年面向合格投资者公开发行公司债券(第一期)(品种二),ETCB 20190813 5Y 4.15%
2020-03-06,沪公司债,山西焦煤集团有限责任公司公开发行2019年公司债券(第一期)(品种一),ETCB 20190812 3Y 3.51%
2020-03-06,沪公司债,山西焦煤集团有限责任公司公开发行2019年公司债券(第一期)(品种二),ETCB 20190812 5Y 3.92%
2020-03-06,沪公司债,华能天成融资租赁有限公司公开发行2019年绿色公司债券(第二期),ETCB 20190809 3Y 3.77%
2020-03-06,沪公司债,中国交通建设股份有限公司2019年面向合格投资者公开发行公司债券(第二期)(品种一),ETCB 20190815 5Y 3.35%
2020-03-06,沪公司债,中国交通建设股份有限公司2019年面向合格投资者公开发行公司债券(第二期)(品种二),ETCB 20190815 10Y 4.35%
2020-03-06,沪公司债,华福证券有限责任公司2019年公开发行公司债券(第一期),ETCB 20190820 3Y 4%
